{
  "artifacts": [],
  "data": {
    "extensions": {},
    "measurement": {
      "algorithm": {
        "id": "openada.algorithm/measurement.mean/v1",
        "version": "1.1.0"
      },
      "extensions": {},
      "kind": "mean",
      "location": null,
      "measurement_id": "inverter.vout.mean",
      "request_sha256": "395a369e48408cc2ffacc92a0bcb21032567f922a204eda6563140836b78b2a2",
      "sample_count": 81,
      "signal": "v(vout)",
      "source": {
        "artifact_role": "measurement.source",
        "artifact_sha256": "64947f6cbdecf72286d7c388e8ed37379f2d671b5305d6c69bc62ef091d66f73",
        "conditions": [
          {
            "name": "corner",
            "unit": "1",
            "value": "mos_tt"
          },
          {
            "name": "supply_voltage",
            "unit": "V",
            "value": 1.2
          }
        ],
        "conditions_sha256": "11294bbcfbf6c39e95aa9b6efcda4f8cf6aeff77dcd600a19c13b4c942f3345c",
        "lineage": {
          "artifact_role": "simulation.result",
          "artifact_sha256": "9fc6f5f9d60321399e4ad4f352176f843136713d7c4378dcc92978a7ee5fc2ab",
          "binding": "unverified",
          "operation": "circuit.simulate",
          "request_id": "10000000-0000-4000-8000-000000000001"
        },
        "operation": "openada.operation/result.series.extract/v1alpha1",
        "request_id": "10000000-0000-4000-8000-000000000002",
        "series_sha256": "64947f6cbdecf72286d7c388e8ed37379f2d671b5305d6c69bc62ef091d66f73"
      },
      "status": "measured",
      "unit": "V",
      "value": 0.664714677053433
    },
    "protocol": {
      "assertion_profile": "openada.assertion/measurement.valid/v1alpha1",
      "implementation_id": "org.openada.kernel.typed-evidence",
      "implementation_version": "1.1.0",
      "operation_profile": "openada.operation/result.measure/v1alpha2",
      "request_id": "11000000-0000-4000-8000-000000000004"
    }
  },
  "diagnostics": [],
  "engineering": {
    "status": "pass",
    "summary": "Derived 'inverter.vout.mean' using the closed mean algorithm."
  },
  "execution": {
    "command": [],
    "duration_ms": 0,
    "exit_code": 0,
    "status": "completed"
  },
  "inputs": [],
  "operation": "result.measure",
  "provenance": {
    "created_at": "2026-08-12T10:47:51.935452Z",
    "host": {
      "machine": "x86_64",
      "python": "3.12.3",
      "system": "Linux"
    },
    "openada_version": "0.4.0"
  },
  "schema": "openada.result/v0alpha1",
  "tool": null
}
