{
  "artifacts": [],
  "data": {
    "capabilities": [
      {
        "assertion_profiles": [
          "openada.assertion/simulation.evidence.valid/v1alpha1"
        ],
        "completion_modes": [
          "wait"
        ],
        "conformance_record_ids": [
          "org.openada.conformance/ihp-analog-analyses-ngspice-provider/v1"
        ],
        "features": [
          "openada.feature/simulation.analysis.op/v1alpha1",
          "openada.feature/simulation.analysis.dc/v1alpha1",
          "openada.feature/simulation.analysis.ac/v1alpha1",
          "openada.feature/simulation.analysis.tran/v1alpha1"
        ],
        "index": 0,
        "locator_types": [
          "filesystem"
        ],
        "maturity": "workflow-validated",
        "native_product_ids": [
          "org.ngspice.simulator"
        ],
        "operation_profile": "openada.operation/circuit.simulate/v1alpha2",
        "side_effect_modes": [
          "evidence-only"
        ],
        "transport_ids": [
          "local-json-stdio"
        ]
      }
    ],
    "driver": {
      "extensions": {},
      "homepage": "https://github.com/simra-tech/OpenADA",
      "id": "org.openada.driver.ngspice-pdk-control",
      "license": "MIT",
      "name": "OpenADA ngspice PDK control-deck provider",
      "source": "https://github.com/simra-tech/OpenADA/tree/main/src/openada/providers/ngspice_pdk_control.py",
      "version": "0.5.0"
    },
    "extensions": {},
    "manifest_schema": "openada.driver-manifest/v0alpha1",
    "runtime_scope": {
      "discovery": "explicit-manifest-only",
      "dispatch": "local-cli-json-stdio-wait-only",
      "marketplace": false,
      "mcp": false,
      "registered_operation_profiles": [
        "openada.operation/circuit.simulate/v1alpha2"
      ]
    },
    "transports": [
      {
        "id": "local-json-stdio",
        "type": "local-cli"
      }
    ]
  },
  "diagnostics": [],
  "engineering": {
    "status": "pass",
    "summary": "External provider org.openada.driver.ngspice-pdk-control@0.5.0 is valid."
  },
  "execution": {
    "command": [],
    "duration_ms": 0,
    "exit_code": 0,
    "status": "completed"
  },
  "inputs": [],
  "operation": "provider.validate",
  "provenance": {
    "created_at": "2026-08-10T09:04:53.332402Z",
    "host": {
      "machine": "x86_64",
      "python": "3.12.3",
      "system": "Linux"
    },
    "openada_version": "0.4.0"
  },
  "schema": "openada.result/v0alpha1",
  "tool": null
}
