{
  "artifacts": [],
  "data": {
    "extensions": {},
    "measurement": {
      "algorithm": {
        "id": "openada.algorithm/measurement.rise-time/v1",
        "version": "1.1.0"
      },
      "extensions": {},
      "kind": "rise_time",
      "location": {
        "unit": "s",
        "value": 1.5164561641794755e-06
      },
      "measurement_id": "inverter.vout.rise-time",
      "request_sha256": "6bfd67f653b188f92ffd0862be0e9a7c5deadac3f520127eb123d5a017f511c2",
      "sample_count": 81,
      "signal": "v(vout)",
      "source": {
        "artifact_role": "measurement.source",
        "artifact_sha256": "64947f6cbdecf72286d7c388e8ed37379f2d671b5305d6c69bc62ef091d66f73",
        "conditions": [
          {
            "name": "corner",
            "unit": "1",
            "value": "mos_tt"
          },
          {
            "name": "supply_voltage",
            "unit": "V",
            "value": 1.2
          }
        ],
        "conditions_sha256": "11294bbcfbf6c39e95aa9b6efcda4f8cf6aeff77dcd600a19c13b4c942f3345c",
        "lineage": {
          "artifact_role": "simulation.result",
          "artifact_sha256": "f184fd9cefcb9b8fdccbe59fb97f0ea03c8112e34153a43d1c6dd3ec9d0c011a",
          "binding": "unverified",
          "operation": "circuit.simulate",
          "request_id": "10000000-0000-4000-8000-000000000001"
        },
        "operation": "openada.operation/result.series.extract/v1alpha1",
        "request_id": "10000000-0000-4000-8000-000000000002",
        "series_sha256": "64947f6cbdecf72286d7c388e8ed37379f2d671b5305d6c69bc62ef091d66f73"
      },
      "status": "measured",
      "unit": "s",
      "value": 3.105653236795353e-09
    },
    "protocol": {
      "assertion_profile": "openada.assertion/measurement.valid/v1alpha1",
      "implementation_id": "org.openada.kernel.typed-evidence",
      "implementation_version": "1.1.0",
      "operation_profile": "openada.operation/result.measure/v1alpha2",
      "request_id": "11000000-0000-4000-8000-000000000007"
    }
  },
  "diagnostics": [],
  "engineering": {
    "status": "pass",
    "summary": "Derived 'inverter.vout.rise-time' using the closed rise_time algorithm."
  },
  "execution": {
    "command": [],
    "duration_ms": 0,
    "exit_code": 0,
    "status": "completed"
  },
  "inputs": [],
  "operation": "result.measure",
  "provenance": {
    "created_at": "2026-08-12T09:10:42.085712Z",
    "host": {
      "machine": "x86_64",
      "python": "3.12.3",
      "system": "Linux"
    },
    "openada_version": "0.4.0"
  },
  "schema": "openada.result/v0alpha1",
  "tool": null
}
