{
  "artifacts": [],
  "data": {
    "extensions": {},
    "profiles": [
      {
        "assertion_profile": "openada.assertion/simulation.evidence.valid/v1alpha1",
        "feature_ids": [
          "openada.feature/simulation.analysis.op/v1alpha1",
          "openada.feature/simulation.analysis.dc/v1alpha1",
          "openada.feature/simulation.analysis.ac/v1alpha1",
          "openada.feature/simulation.analysis.tran/v1alpha1"
        ],
        "operation_profile": "openada.operation/circuit.simulate/v1alpha1",
        "schema": "openada.operation-profile/v0alpha1"
      },
      {
        "assertion_profile": "openada.assertion/simulation.evidence.valid/v1alpha1",
        "feature_ids": [
          "openada.feature/simulation.analysis.op/v1alpha1",
          "openada.feature/simulation.analysis.dc/v1alpha1",
          "openada.feature/simulation.analysis.ac/v1alpha1",
          "openada.feature/simulation.analysis.tran/v1alpha1"
        ],
        "operation_profile": "openada.operation/circuit.simulate/v1alpha2",
        "schema": "openada.operation-profile/v0alpha1"
      },
      {
        "assertion_profile": "openada.assertion/synthesized-netlist.valid/v1alpha1",
        "feature_ids": [
          "openada.feature/synthesis.asic-liberty/v1alpha1"
        ],
        "operation_profile": "openada.operation/logic.synthesize/v1alpha1",
        "schema": "openada.operation-profile/v0alpha2"
      },
      {
        "assertion_profile": "openada.assertion/measurement.valid/v1alpha1",
        "feature_ids": [
          "openada.feature/measurement.sample-at/v1alpha1",
          "openada.feature/measurement.minimum/v1alpha1",
          "openada.feature/measurement.maximum/v1alpha1",
          "openada.feature/measurement.mean/v1alpha1",
          "openada.feature/measurement.rms/v1alpha1",
          "openada.feature/measurement.crossing/v1alpha1",
          "openada.feature/measurement.rise-time/v1alpha1",
          "openada.feature/measurement.fall-time/v1alpha1",
          "openada.feature/measurement.settling-time/v1alpha1"
        ],
        "operation_profile": "openada.operation/result.measure/v1alpha1",
        "schema": "openada.operation-profile/v0alpha2"
      },
      {
        "assertion_profile": "openada.assertion/measurement.valid/v1alpha1",
        "feature_ids": [
          "openada.feature/measurement.sample-at/v1alpha1",
          "openada.feature/measurement.minimum/v1alpha1",
          "openada.feature/measurement.maximum/v1alpha1",
          "openada.feature/measurement.mean/v1alpha1",
          "openada.feature/measurement.rms/v1alpha1",
          "openada.feature/measurement.crossing/v1alpha1",
          "openada.feature/measurement.rise-time/v1alpha1",
          "openada.feature/measurement.fall-time/v1alpha1",
          "openada.feature/measurement.settling-time/v1alpha1",
          "openada.feature/measurement.slope/v1alpha1"
        ],
        "operation_profile": "openada.operation/result.measure/v1alpha2",
        "schema": "openada.operation-profile/v0alpha2"
      },
      {
        "assertion_profile": "openada.assertion/oscillator.measurement.valid/v1alpha1",
        "feature_ids": [
          "openada.feature/oscillator.crossing-frequency/v1alpha1",
          "openada.feature/oscillator.startup-hold/v1alpha1",
          "openada.feature/oscillator.differential-amplitude/v1alpha1",
          "openada.feature/oscillator.average-supply-power/v1alpha1",
          "openada.feature/oscillator.local-tuning-gain/v1alpha1",
          "openada.feature/oscillator.frequency-span/v1alpha1",
          "openada.feature/oscillator.perturbation-shift/v1alpha1"
        ],
        "operation_profile": "openada.operation/result.osc.measure/v1alpha1",
        "schema": "openada.operation-profile/v0alpha2"
      },
      {
        "assertion_profile": "openada.assertion/series.extraction.valid/v1alpha1",
        "feature_ids": [],
        "operation_profile": "openada.operation/result.series.extract/v1alpha1",
        "schema": "openada.operation-profile/v0alpha2"
      },
      {
        "assertion_profile": "openada.assertion/spectral.measurement.valid/v1alpha1",
        "feature_ids": [
          "openada.feature/spectral.snr/v1alpha1",
          "openada.feature/spectral.sinad/v1alpha1",
          "openada.feature/spectral.thd/v1alpha1",
          "openada.feature/spectral.sfdr/v1alpha1"
        ],
        "operation_profile": "openada.operation/result.spectral.measure/v1alpha1",
        "schema": "openada.operation-profile/v0alpha2"
      },
      {
        "assertion_profile": "openada.assertion/transfer.measurement.valid/v1alpha1",
        "feature_ids": [
          "openada.feature/transfer.low-frequency-gain/v1alpha1",
          "openada.feature/transfer.low-frequency-impedance/v1alpha1",
          "openada.feature/transfer.differential-operands/v1alpha1",
          "openada.feature/transfer.bandwidth-3db/v1alpha1",
          "openada.feature/transfer.unity-gain-frequency/v1alpha1",
          "openada.feature/transfer.phase-margin/v1alpha1"
        ],
        "operation_profile": "openada.operation/result.transfer.measure/v1alpha1",
        "schema": "openada.operation-profile/v0alpha2"
      },
      {
        "assertion_profile": "openada.assertion/transfer.measurement.valid/v1alpha1",
        "feature_ids": [
          "openada.feature/transfer.low-frequency-gain/v1alpha1",
          "openada.feature/transfer.low-frequency-impedance/v1alpha1",
          "openada.feature/transfer.ac-magnitude-at-frequency/v1alpha1",
          "openada.feature/transfer.differential-operands/v1alpha1",
          "openada.feature/transfer.bandwidth-3db/v1alpha1",
          "openada.feature/transfer.unity-gain-frequency/v1alpha1",
          "openada.feature/transfer.phase-margin/v1alpha1"
        ],
        "operation_profile": "openada.operation/result.transfer.measure/v1alpha2",
        "schema": "openada.operation-profile/v0alpha2"
      },
      {
        "assertion_profile": "openada.assertion/rtl.lint.clean/v1alpha1",
        "feature_ids": [
          "openada.feature/rtl.lint.systemverilog/v1alpha1"
        ],
        "operation_profile": "openada.operation/rtl.lint/v1alpha1",
        "schema": "openada.operation-profile/v0alpha2"
      },
      {
        "assertion_profile": "openada.assertion/rtl.self-test.passes/v1alpha1",
        "feature_ids": [
          "openada.feature/rtl.test.backend/v1alpha1"
        ],
        "operation_profile": "openada.operation/rtl.test/v1alpha1",
        "schema": "openada.operation-profile/v0alpha2"
      },
      {
        "assertion_profile": "openada.assertion/specification.satisfied/v1alpha1",
        "feature_ids": [
          "openada.feature/specification.bound-evaluation/v1alpha1",
          "openada.feature/specification.condition-binding/v1alpha1"
        ],
        "operation_profile": "openada.operation/specification.evaluate/v1alpha1",
        "schema": "openada.operation-profile/v0alpha2"
      },
      {
        "assertion_profile": "openada.assertion/testbench.analyses.evidence.valid/v1alpha1",
        "feature_ids": [
          "openada.feature/testbench.analysis.split/v1alpha1",
          "openada.feature/testbench.model.collateral/v1alpha1"
        ],
        "operation_profile": "openada.operation/testbench.simulate/v1alpha1",
        "schema": "openada.operation-profile/v0alpha2"
      },
      {
        "assertion_profile": "openada.assertion/timing.constraints-satisfied/v1alpha1",
        "feature_ids": [
          "openada.feature/timing.setup-hold/v1alpha1"
        ],
        "operation_profile": "openada.operation/timing.analyze/v1alpha1",
        "schema": "openada.operation-profile/v0alpha2"
      }
    ]
  },
  "diagnostics": [],
  "engineering": {
    "status": "pass",
    "summary": "Listed 15 packaged operation profiles."
  },
  "execution": {
    "command": [],
    "duration_ms": 0,
    "exit_code": 0,
    "status": "completed"
  },
  "inputs": [],
  "operation": "profile.list",
  "provenance": {
    "created_at": "2026-08-12T09:12:19.448649Z",
    "host": {
      "machine": "x86_64",
      "python": "3.12.3",
      "system": "Linux"
    },
    "openada_version": "0.4.0"
  },
  "schema": "openada.result/v0alpha1",
  "tool": null
}
