{
  "artifacts": [
    {
      "bytes": 1700,
      "exists": true,
      "kind": "spice-netlist",
      "path": "/evidence/work/ota.cir",
      "role": "output",
      "sha256": "155e50b29e95da3cad518bff83f5edcb9424fede3ac21dfc6e419720e635e84f"
    }
  ],
  "data": {
    "missing_symbol_count": 0,
    "missing_symbols": [],
    "missing_symbols_truncated": false,
    "stderr_tail": "",
    "stdout_tail": ""
  },
  "diagnostics": [],
  "engineering": {
    "status": "pass",
    "summary": "Xschem generated a SPICE netlist."
  },
  "execution": {
    "command": [
      "/foss/tools/xschem/bin/xschem",
      "--rcfile",
      "/evidence/sources/ota.xschemrc",
      "-n",
      "-s",
      "-q",
      "-x",
      "-o",
      "/tmp/openada-xschem-oi_47mdq",
      "/evidence/sources/ota-ac.sch"
    ],
    "cwd": "/evidence/sources",
    "duration_ms": 115,
    "exit_code": 0,
    "status": "completed"
  },
  "inputs": [
    {
      "bytes": 5174,
      "exists": true,
      "kind": "xschem-schematic",
      "path": "/evidence/sources/ota-ac.sch",
      "role": "input",
      "sha256": "28e085425fe0927d9aaa55b354fc3ba089aeca252906c27465ceac1be024b253"
    },
    {
      "bytes": 148,
      "exists": true,
      "kind": "xschem-rcfile",
      "path": "/evidence/sources/ota.xschemrc",
      "role": "configuration",
      "sha256": "cbc13483f3fed0189c0f228ee9cf1dcba0fbbb188ac8f7598c24b034a393f7ba"
    }
  ],
  "operation": "netlist",
  "provenance": {
    "created_at": "2026-08-12T09:07:05.879756Z",
    "host": {
      "machine": "x86_64",
      "python": "3.12.3",
      "system": "Linux"
    },
    "openada_version": "0.4.0"
  },
  "schema": "openada.result/v0alpha1",
  "tool": {
    "name": "xschem",
    "path": "/foss/tools/xschem/bin/xschem",
    "version": "XSCHEM V3.4.8RC"
  }
}
