{
  "artifacts": [],
  "data": {
    "extensions": {},
    "extraction": {
      "extensions": {},
      "plot": {
        "encoding": "binary",
        "extensions": {},
        "native_axis_name": "v(v-sweep)",
        "native_axis_type": "voltage",
        "numeric_type": "real",
        "plotname": "DC transfer characteristic",
        "point_count": 13
      },
      "request_sha256": "526f15c112ecb7b610879cb803b4370f6fa8bfd432c76d015508d0753c072d9b",
      "series": {
        "axis": {
          "name": "V1",
          "unit": "V",
          "values": [
            0.0,
            0.1,
            0.2,
            0.30000000000000004,
            0.4,
            0.5,
            0.6,
            0.7,
            0.7999999999999999,
            0.8999999999999999,
            0.9999999999999999,
            1.0999999999999999,
            1.2
          ]
        },
        "conditions": [
          {
            "name": "design",
            "unit": "1",
            "value": "IHP-AnalogAcademy/inverter"
          },
          {
            "name": "corner",
            "unit": "1",
            "value": "mos_tt"
          },
          {
            "name": "supply_voltage",
            "unit": "V",
            "value": 1.2
          }
        ],
        "extensions": {},
        "signals": [
          {
            "name": "vin",
            "unit": "V",
            "values": [
              0.0,
              0.1,
              0.2,
              0.30000000000000004,
              0.4,
              0.5,
              0.6,
              0.7,
              0.7999999999999999,
              0.8999999999999999,
              0.9999999999999999,
              1.0999999999999999,
              1.2
            ]
          },
          {
            "name": "vout",
            "unit": "V",
            "values": [
              1.1999991371378251,
              1.1999821647355282,
              1.1995668132030595,
              1.1933341038161762,
              1.1613324798160294,
              0.9996546013996847,
              0.05632438810387294,
              0.014353578993366742,
              0.0024472898013708434,
              0.0001623108357954839,
              6.7409971558476075e-06,
              4.0885458551456e-07,
              2.0155029358116112e-07
            ]
          }
        ],
        "source": {
          "artifact_role": "measurement.source",
          "artifact_sha256": "ea5c4cce0704d76b20d3ba015077026dded6d32be26d166162d295a7550b06ec",
          "lineage": {
            "artifact_role": "simulation.result",
            "artifact_sha256": "394d351487a61b058b60654252417ff93780010aad7d91c5ab85717b1019d458",
            "binding": "unverified",
            "operation": "circuit.simulate",
            "request_id": "22f23228-f701-42d2-855c-6ab20f351bc2"
          },
          "operation": "openada.operation/result.series.extract/v1alpha1",
          "request_id": "21000000-0000-4000-8000-000000000002"
        }
      },
      "source": {
        "analysis_type": "dc",
        "artifact": {
          "bytes": 1862,
          "exists": true,
          "kind": "ngspice-raw",
          "path": "/evidence/sim/ngspice-dc/inverter-dc/inverter-dc.raw",
          "role": "simulation.result",
          "sha256": "394d351487a61b058b60654252417ff93780010aad7d91c5ab85717b1019d458"
        },
        "backend": "ngspice",
        "binding": "verified",
        "driver_id": "org.openada.driver.ngspice",
        "driver_version": "0.4.0",
        "operation_profile": "openada.operation/circuit.simulate/v1alpha2",
        "request_id": "22f23228-f701-42d2-855c-6ab20f351bc2"
      },
      "status": "extracted"
    },
    "protocol": {
      "assertion_profile": "openada.assertion/series.extraction.valid/v1alpha1",
      "implementation_id": "org.openada.kernel.spice3-series",
      "implementation_version": "1.0.0",
      "operation_profile": "openada.operation/result.series.extract/v1alpha1",
      "request_id": "21000000-0000-4000-8000-000000000002"
    }
  },
  "diagnostics": [],
  "engineering": {
    "status": "pass",
    "summary": "Extracted a bounded normalized real series from exact native simulation evidence."
  },
  "execution": {
    "command": [],
    "duration_ms": 0,
    "exit_code": 0,
    "status": "completed"
  },
  "inputs": [
    {
      "bytes": 1862,
      "exists": true,
      "kind": "ngspice-raw",
      "path": "/evidence/sim/ngspice-dc/inverter-dc/inverter-dc.raw",
      "role": "simulation.result",
      "sha256": "394d351487a61b058b60654252417ff93780010aad7d91c5ab85717b1019d458"
    }
  ],
  "operation": "result.series.extract",
  "provenance": {
    "created_at": "2026-08-12T10:49:41.349004Z",
    "host": {
      "machine": "x86_64",
      "python": "3.12.3",
      "system": "Linux"
    },
    "openada_version": "0.4.0"
  },
  "schema": "openada.result/v0alpha1",
  "tool": null
}
