{
  "artifacts": [],
  "data": {
    "evaluation": {
      "algorithm": {
        "id": "openada.algorithm/specification.closed-interval/v1",
        "version": "1.0.0"
      },
      "conditions": {
        "matched_count": 2,
        "required_count": 2,
        "status": "matched"
      },
      "extensions": {},
      "limits": [
        {
          "inclusive": true,
          "kind": "upper",
          "unit": "s",
          "value": 1e-07
        }
      ],
      "margin": {
        "relative_to": "upper",
        "unit": "s",
        "value": 9.713518926412875e-08
      },
      "measured": {
        "unit": "s",
        "value": 2.864810735871247e-09
      },
      "measurement_id": "inverter.vout.fall-time",
      "source": {
        "measurement_sha256": "fc927fa67dc0610d918a8e948d2cb5e3dee6ada439f0417dea44fdb9377819c9",
        "measurement_source": {
          "artifact_role": "measurement.source",
          "artifact_sha256": "64947f6cbdecf72286d7c388e8ed37379f2d671b5305d6c69bc62ef091d66f73",
          "conditions": [
            {
              "name": "corner",
              "unit": "1",
              "value": "mos_tt"
            },
            {
              "name": "supply_voltage",
              "unit": "V",
              "value": 1.2
            }
          ],
          "conditions_sha256": "11294bbcfbf6c39e95aa9b6efcda4f8cf6aeff77dcd600a19c13b4c942f3345c",
          "lineage": {
            "artifact_role": "simulation.result",
            "artifact_sha256": "f184fd9cefcb9b8fdccbe59fb97f0ea03c8112e34153a43d1c6dd3ec9d0c011a",
            "binding": "unverified",
            "operation": "circuit.simulate",
            "request_id": "10000000-0000-4000-8000-000000000001"
          },
          "operation": "openada.operation/result.series.extract/v1alpha1",
          "request_id": "10000000-0000-4000-8000-000000000002",
          "series_sha256": "64947f6cbdecf72286d7c388e8ed37379f2d671b5305d6c69bc62ef091d66f73"
        },
        "specification": {
          "conditions": [
            {
              "name": "corner",
              "unit": "1",
              "value": "mos_tt"
            },
            {
              "name": "supply_voltage",
              "unit": "V",
              "value": 1.2
            }
          ],
          "extensions": {},
          "limits": {
            "upper": {
              "inclusive": true,
              "unit": "s",
              "value": 1e-07
            }
          },
          "measurement_id": "inverter.vout.fall-time",
          "specification_id": "inverter.vout.fall-time.pass-limit"
        },
        "specification_sha256": "3341c72c7f7e57e9c30e1e966c44ed1b1dd2779b8b5ca28bbc7b4d8f9c17f0d2"
      },
      "specification_id": "inverter.vout.fall-time.pass-limit",
      "status": "pass"
    },
    "extensions": {},
    "protocol": {
      "assertion_profile": "openada.assertion/specification.satisfied/v1alpha1",
      "implementation_id": "org.openada.kernel.typed-evidence",
      "implementation_version": "1.0.0",
      "operation_profile": "openada.operation/specification.evaluate/v1alpha1",
      "request_id": "12000000-0000-4000-8000-000000000008"
    }
  },
  "diagnostics": [],
  "engineering": {
    "status": "pass",
    "summary": "Specification 'inverter.vout.fall-time.pass-limit' is satisfied."
  },
  "execution": {
    "command": [],
    "duration_ms": 0,
    "exit_code": 0,
    "status": "completed"
  },
  "inputs": [],
  "operation": "specification.evaluate",
  "provenance": {
    "created_at": "2026-08-12T09:10:52.950059Z",
    "host": {
      "machine": "x86_64",
      "python": "3.12.3",
      "system": "Linux"
    },
    "openada_version": "0.4.0"
  },
  "schema": "openada.result/v0alpha1",
  "tool": null
}
