{
  "artifacts": [],
  "data": {
    "evaluation": {
      "algorithm": {
        "id": "openada.algorithm/specification.closed-interval/v1",
        "version": "1.0.0"
      },
      "conditions": {
        "matched_count": 2,
        "required_count": 2,
        "status": "matched"
      },
      "extensions": {},
      "limits": [
        {
          "inclusive": true,
          "kind": "upper",
          "unit": "V",
          "value": 0.2
        }
      ],
      "margin": {
        "relative_to": "upper",
        "unit": "V",
        "value": 0.20271667018414047
      },
      "measured": {
        "unit": "V",
        "value": -0.002716670184140451
      },
      "measurement_id": "inverter.vout.minimum",
      "source": {
        "measurement_sha256": "4f4444dadece8d565383a5dfc07313b45b37593d643fd6434256e60aa5944f67",
        "measurement_source": {
          "artifact_role": "measurement.source",
          "artifact_sha256": "64947f6cbdecf72286d7c388e8ed37379f2d671b5305d6c69bc62ef091d66f73",
          "conditions": [
            {
              "name": "corner",
              "unit": "1",
              "value": "mos_tt"
            },
            {
              "name": "supply_voltage",
              "unit": "V",
              "value": 1.2
            }
          ],
          "conditions_sha256": "11294bbcfbf6c39e95aa9b6efcda4f8cf6aeff77dcd600a19c13b4c942f3345c",
          "lineage": {
            "artifact_role": "simulation.result",
            "artifact_sha256": "9fc6f5f9d60321399e4ad4f352176f843136713d7c4378dcc92978a7ee5fc2ab",
            "binding": "unverified",
            "operation": "circuit.simulate",
            "request_id": "10000000-0000-4000-8000-000000000001"
          },
          "operation": "openada.operation/result.series.extract/v1alpha1",
          "request_id": "10000000-0000-4000-8000-000000000002",
          "series_sha256": "64947f6cbdecf72286d7c388e8ed37379f2d671b5305d6c69bc62ef091d66f73"
        },
        "specification": {
          "conditions": [
            {
              "name": "corner",
              "unit": "1",
              "value": "mos_tt"
            },
            {
              "name": "supply_voltage",
              "unit": "V",
              "value": 1.2
            }
          ],
          "extensions": {},
          "limits": {
            "upper": {
              "inclusive": true,
              "unit": "V",
              "value": 0.2
            }
          },
          "measurement_id": "inverter.vout.minimum",
          "specification_id": "inverter.vout.minimum.pass-limit"
        },
        "specification_sha256": "fa8f62a41d421cba8af0b451aaad67861f5e59cd0e79de9c61d8cb712b80dd0c"
      },
      "specification_id": "inverter.vout.minimum.pass-limit",
      "status": "pass"
    },
    "extensions": {},
    "protocol": {
      "assertion_profile": "openada.assertion/specification.satisfied/v1alpha1",
      "implementation_id": "org.openada.kernel.typed-evidence",
      "implementation_version": "1.0.0",
      "operation_profile": "openada.operation/specification.evaluate/v1alpha1",
      "request_id": "12000000-0000-4000-8000-000000000002"
    }
  },
  "diagnostics": [],
  "engineering": {
    "status": "pass",
    "summary": "Specification 'inverter.vout.minimum.pass-limit' is satisfied."
  },
  "execution": {
    "command": [],
    "duration_ms": 0,
    "exit_code": 0,
    "status": "completed"
  },
  "inputs": [],
  "operation": "specification.evaluate",
  "provenance": {
    "created_at": "2026-08-12T10:47:40.759835Z",
    "host": {
      "machine": "x86_64",
      "python": "3.12.3",
      "system": "Linux"
    },
    "openada_version": "0.4.0"
  },
  "schema": "openada.result/v0alpha1",
  "tool": null
}
